NCT_ID,Title,Sponsor,Has_Protocol_Doc,Planned_Enrollment,Allocation,URL
NCT03972943,CPAP in Treating Obstructive Sleep Apnea in Patients With Polycythemia Vera or Essential Thrombocythemia,University of Utah,False,8,NON_RANDOMIZED,https://clinicaltrials.gov/study/NCT03972943
NCT01000870,Safety and Efficacy of Positron Emission Tomography Imaging With MNI-513,Institute for Neurodegenerative Disorders,False,6,NA,https://clinicaltrials.gov/study/NCT01000870
NCT06636175,64Cu-LLP2A for Imaging Hematologic Malignancies,Washington University School of Medicine,False,42,NON_RANDOMIZED,https://clinicaltrials.gov/study/NCT06636175
NCT07261657,N-803 in Patients With Progressive Synovial Sarcoma and Myxoid/Round Cell Liposarcoma Previously Treated With Adoptive Cellular Therapy,Seth Pollack,False,8,NA,https://clinicaltrials.gov/study/NCT07261657
NCT07585851,Administration of Repurposed Ketoconazole in Glioma Patients,Universitas Padjadjaran,False,80,NA,https://clinicaltrials.gov/study/NCT07585851
NCT07605520,An Experimental Medicine Multicenter Trial to Evaluate the Safety and Immunogenicity of Experimental Versus Authorized SARS-CoV-2 Vaccine Candidates as a Booster Dose in Healthy Participants Previously Vaccinated With Authorized mRNA SARS-CoV-2 Vaccines.,"ANRS, Emerging Infectious Diseases",False,48,RANDOMIZED,https://clinicaltrials.gov/study/NCT07605520
NCT04937413,The PCSK9i Inhibitor Evolocumab - a Surgical Trial of Pharamcodynamics and Kinetics Evaluation,Duke University,True,32,NA,https://clinicaltrials.gov/study/NCT04937413
NCT03402230,Broccoli Sprout/Broccoli Seed Extract Supplement in Decreasing Toxicity in Heavy Smokers,National Cancer Institute (NCI),True,49,RANDOMIZED,https://clinicaltrials.gov/study/NCT03402230
NCT06045091,To Evaluate the Safety and Efficacy of Human BCMA Targeted CAR-NK Cells Injection for Subjects With R/R MM or PCL,"Hrain Biotechnology Co., Ltd.",False,18,NA,https://clinicaltrials.gov/study/NCT06045091
NCT04638803,Microdose Pharmacokinetic Study of PRX-P4-003 In Healthy Volunteers,"Praxis Bioresearch, LLC",False,6,NON_RANDOMIZED,https://clinicaltrials.gov/study/NCT04638803
NCT06824155,HEAT Trial (HER2 Antibody Therapy With Lutetium-177),"Radiopharm Theranostics, Ltd",False,30,NA,https://clinicaltrials.gov/study/NCT06824155
NCT03197389,Effect of Pembrolizumab (Keytruda®) on Biomarkers in Early Breast Cancer.,Universitaire Ziekenhuizen KU Leuven,True,54,NON_RANDOMIZED,https://clinicaltrials.gov/study/NCT03197389
NCT03868020,Fluciclovine F18 PET/CT in Identifying the Origin of Head and Neck Squamous Cell Carcinoma in Patients With Metastatic Cervical Nodal Disease,M.D. Anderson Cancer Center,False,16,NA,https://clinicaltrials.gov/study/NCT03868020
